Comment,Stock,Price,Date,Label
TSLA 650 call exp 2/21 bought at 205,TSLA,650,2/21,1
RIP 5/10 44.50 EEM CALLS,EEM,44.50,5/10,1
Sweet all in on MU $90 8/24’s ,MU,90,8/24,1
I can't afford to rent movies until my uncovered SQ $28 Jan 19 calls expire worthless.,SQ,28,Jan 19,1
Why didn't I sell my 4/20 $11 AMD calls yesterday? RIP,AMD,11,4/20,1
Shiiiit I sold my $234 spy puts today. I’ll probably grab some $138.5 12/28 QQQ puts now.,QQQ,138.5,12/28,1
"I’m still on the fence with my $WDC calls. I’ve got 10 $90 May 25s. Made 376% on them today, but I feel like it’s coasting back up to $90 easy by next Friday. After a 5% day though, ehhh I’m not too sure. ",WDC,90,May 25,1
Holding AMD 12/27 47.5c,AMD,47.5,12/27,1
Msft 3/15 105 puts ,Msft,105,3/15,1
Lol nope. May 11 260 call. R.I.P.,Lol,260,May 11,1
Anyone still holding their MCD calls or did you pussies all bail on me?   $215 10/4 B A L L D E E P,MCD,215,10/4,1
Well on a bright side. I picked up $MTN (vail resort) April $200 calls,MTN,200,April,1
Got a 5/3 $1350 GOOG call. Correct play here is sell before earnings right?,GOOG,1350,5/3,1
"Welp, better throw the last 400 in something triple leveraged. I suggest SPXL 44.4 July 20 puts, they're $1.55 now. It just crossed above the 200 &amp; 50 day SMA and in the past it's dipped shortly after doing that.",SPXL,44.4,July 20,1
Hold LMT 412.5c  1/10 over the weekend or dump them? They’re up 62% for me. Were up 100% earlier.,LMT,412.5,1/10,1
"Bought 2/8 AMZN $1600 Calls at the dip, up 25% already",AMZN,1600,2/8,1
When does the economic data come out? Need to know when to hold my 2/1 $166 QQQ calls til. Gonna need strong hands for this open.,QQQ,166,2/1,1
Bought Aug 26 $93 Puts on BABA @ $.41 Shopped UVXY calls but didn't like todays action. Expecting a Gap-Up and Fade day on SPY tomorrow so buying a small batch of UVXY Calls at open for 8/19 exp just out of the money and padding them with a larger in the money position of Sept 9th expiration calls. #blackswanhunting ,UVXY,93,8/19,1
Yo wtf is up with $12 6/21 Ford calls? Is that like a glitch or did i get real lucky,Ford,12,6/21,1
Just sold 4 cash coverd contracts for CLX$   145 11/22   Easy money and a decent asset if i get assigned   💪💪💪😏. Theta gang style,CLX,145,11/22,1
12/6 PTON $37 calls.  Come on baby. Run.,PTON,37,12/6,1
Bought msft 116 3/29 calls on the dip a little while ago. Let’s do this Billy ,msft,116,3/29,1
AMC stock price is going up but why is my 10/19 $20 call going down?,AMC,20,10/19,1
This is very odd I can't find the 7/20 90 Calls on RH.,RH,90,7/20,1
I missed NOK they were trading at like $4.80 last week. July $5 calls were basically free whoops,NOK,5,July,1
I sold my Jan 20 9 amd calls and bought weekly 9.5 puts. Based on what happens tomorrow I might just put it all in cost or back in Jan 20 calls.,amd,9.5,Jan 20 9,1
"$USO creeping back, if it holds for friday's open i think my 7/12 $12 calls will be profitable.",USO,12,7/12,1
"Do you mean at a lower price? I have 20 $162 12/21 QQQ puts that I'm holding. G20 meeting put the Dow super high and then it lost 1500 points in a week!! Between now and Friday, we could see Dow 30k AND Dow 20k lol",QQQ,162,12/21,1
"Just averaged down on some cvs 57.5 calls, expiring Friday. Avg is .20 now....how fucked am I? ",cvs,57.5,Friday,1
AMD 30.5c 9/16 keep the hands strong boyos.,AMD,30.5,9/16,1
"Exactly. Everyone is thinking oh no SPY not strong enough to close above $280 for several days, gonna be down, all in puts, and look at the size of the rally anyway, overdue a drop bla bla  &amp;#x200B;  and SPY is gonna continue its steady march up and up and up and most of us retards will continue trying to call the top instead of going all in on SPY $400 DEC21 calls and sitting back.",SPY,400,DEC21,1
"it's an emergency account for if i get an unexpected bill, dingus. I'm yet to figure out how to pay for short notice plane tickets for a funeral, or dental care, with MU $90 27/7 calls mate.",MU,90,27/7,1
"AMD!!!!!!!!! pLeASE I have lost 5 figures Edit: 1/17 $50 calls, way overplayed myself",AMD,50,1/17,1
SPY 293 8/21 calls,SPY,293,8/21,1
Sit on my 8/24 $19 AMD puts and prepare the oven for tendies ,AMD,19,8/24,1
"Technicals on ETF's is dumb. That being said, I'm with you on a  LABU rebound and am in for a few contracts of $39 jan 20th calls.",ETF,39,jan 20th,1
straddle BA 400 June expiration,BA,400,June,1
Are you saying my SPY 7/8 $272s have a chance?,SPY,272,7/8,1
"Do I...  Do I hold a DAL 7/12 60.5/61.5 Call Spread?  Max risk ~800, Max gain ~3200",DAL,60.5,7/12,1
"Yoloed my whole portfolio into 9/13 297.5 ULTA calls, 5 contracts at 34.40 a pop",ULTA,297.5,9/13,1
"Awesome, I bought Jan 19 $220, up about 30% currently... That and my amzn calls I bought at open and sold for 25%.... Today has been a good day (knocks on wood)  Edit: nooooooo, stupid Trump",amzn,220,Jan 19,1
Holding $37 9/20 calls can you do DD on those pls,pl,37,9/20,1
"I was being ironic... Fuck that pussy shit, and Fuck u pussy downvoters. You already know I bought them MU $70 8/03 calls, I ain't no bitch.",MU,70,8/03,1
12 GILD Mar 17 2017 65.00 Calls @ 2.30   Bonus trade: my massive losses on my BWLD trade today.  http://imgur.com/LtNTYXc,GILD,65.00,Mar 17 2017,1
"Down 20% on SPY 299.50p 10/30 :(  To all the mildly informed degenerates, am I FUcKEd?  edit: accidentally wrote 11/30 in previous comment",SPY,299.,10/30,1
9/20 uvxy $32 call dead?,uvxy,32,9/20,1
$ELY 8/16 $20 calls and hold through earnings on 8/1!!!,ELY,20,8/16,1
"That is great but now you need to sell options to capture the sideways and flat weeks and months that will happen..   So on days like this, sell a few call spreads $4+ above the current price of SPY expiring this friday with those shares.",SPY,4,friday,1
ALL IN INTC JAN 2019 $60 CALLS,INTC,60,JAN 2019,1
Dec 6th $AMD calls $41 @ .91  is that free money??,AMD,41,Dec 6th,1
Thoughts on going all in on octover 18 amd $30 calls?,amd,30,octover 18,1
"Yeah, I'm going to pick up Oct 19 $17 puts as well.. Pretty confident we wont see AMD this high for long",AMD,17,Oct 19,1
Ok boys. Need some serious input here.  I have $350 puts on UNH expiring Friday. I bought them yesterday at ~$0.49 per contract.  Would you sell at open or hold a couple more days to see if there's further drop?,UNH,350,Friday,1
I got aapl 227.5c 8/31. What to do ?,aapl,227.5,8/31,1
"This isn't DD, post something usefull. If you really want to do that trade, short the $95 call for 9/21 as well.",DD,95,9/21,1
CHGG Nov 16 covered call for $25 strike is basically guaranteed money at $2.10 per contract,CHGG,25,Nov 16,1
S2C EA calls today and went back into Jan $220 SPY calls. May add to position if markets open in the red,SPY,220,Jan,1
I sold CRWD at $73.40 for a +8% trade  I gave in to 👐smol weak hands👐 feels bad 😔  FOMOd into a 8/2 GLD $136C at the likely HOD   #🏅🤠🏅,CRWD,73.40,8/2,1
And I'm just sitting here hoping my 7/13 $56.5 FD goes green.  I won't get much work done today.,F,56.5,7/13,1
"what about for options? how do wash sale works in options. Say i buy AMD calls at $31 6/21, but sell for a loss of 100 and 1 to 2 days later buy 7/21 $35 calls. is this wash sale?",AMD,31,6/21,1
AMD 43 1/3 puts let’s go!,AMD,43,1/3,1
"Positions are maxr 7.5 calls for 6/21, 7/19 and 10/18",maxr,7.5,6/21,1
"I'm on both now, ATVI 11/9 75.5c and TTWO 11/9 128c",ATVI,75.5,11/9,1
SPY 5/17 $288 puts. Come market you know you want to pull back next week,SPY,288,5/17,1
I have 17 August 2nd 12.50 calls. I bought them when uso was in 11.90’s I averaged down on half at 5 dollars a contract. But with Iran I wouldn’t bed the low last too long.,us,12.50,August 2nd,1
Thinking about going all in on BBY 9/6 $66 Puts.  Is this an autistic enough move or should I not play?,BBY,66,9/6,1
SPY 10/18 305 Calls with 119k open interest? Are people really that bullish on those calls?,SPY,305,10/18,1
ANF $25 8/31 calls wish me luck boys,ANF,25,8/31,1
Was down 28% and bought a handful of 5.50 Sprint calls that all exploded when they announced the T-Mobile merger. Then blew it on 4/20 5.50 Sprint puts.,Sprint,5.50,4/20,1
Ha - coincidentally that's about exactly what I put in. Under $400 on $17 put strikes into May.  Got it - outside my current domain. Relatively new accountant / consultant here.,Ha,17,May,1
MU 9/21 $42 puts in boys sorry,MU,42,9/21,1
I sold my Nov21 daily SPY $265 puts 4 mins before market close. Could I have held on and sold them after-hours? Or do they expire at 4PM EST?  ,SPY,265,Nov21,1
ALT 2.5 Oct calls are cheap..,ALT,2.5,Oct,1
"Oh sweet, 5 days later.  Good shit though man. Still trying to get more technical. Sold my WMT Dec $60 calls for 134% yesterday. Wooo ERIC calls for 100%",WMT,60,Dec,1
I'm pretty new to this but looking at some cheap 05/17 PBCT $18 calls... Their P/E seems very low and announce earnings tomorrow. I know almost nothing about them so what could go wrong?!,PBCT,18,05/17,1
$5k into 10/15 SPY $273?,SPY,273,10/15,1
I bought CRON calls when it dropped. 1/19 $10. I was 100% upside in a week. I held. I wish I had weak hands... and less stupid. Still holding at 10% upside.,CRON,10,1/19,1
"Made $1800 today on CRM and GLD. Got back into GLD with a higher strike price (142.5) and further out expiry date (9/13). Also sold the same number of  8/30 GLD 146c. Wondering if I'll regret that.  Bought 4 of the 8/30 BA 332p....ya know, just in case Trump tweets send it back to December levels. Gonna try to relax this weekend and not think about any of it.",CRM,142.5,9/13,1
SPY 280 calls FEB 16th got it,SPY,280,FEB 16th,1
So I got in SQ at the bottom today because it seemed oversold to me. I got some Jun 21 $72 Calls.   If I wanted to bet on the stock slowly coming back the whole day what Calls would’ve maximized my profits? Should I have played FD’s on this?,SQ,72,Jun 21,1
Sell my $120 March BYND for 100% gain or keep riding? Only got 1 call unfortunate on Friday,BYND,120,March,1
If TSLA crosses Dec 20 $390 callls once it breaks over $386 is a good trade. 650k volume on a 10m chart.,TSLA,390,Dec 20,1
"ABBV is the only biotech you should buy and yes, I'm saying that because I have three Jan 2019 $95 strike calls that are up 400%",ABBV,95,Jan 2019,1
$36 amd calls Jan 2020 are 1.17 what y'all reccomend,amd,36,Jan 2020,1
Dude i have 79 09/20 SPY $255 puts.   I feel you.,SPY,255,09/20,1
"Agree that markets love Trump. Notably however, gold tanked for the interest rate hike news rather than the Trump train in particular.  I have a couple $9 JNUG puts for 1/27.",JNUG,9,1/27,1
"I made 13% on BYND today, I just hope that the 10 5/13 $290 SPY Calls that I bought and cant sell until tomorrow holds up",SPY,290,5/13,1
Bought Jan 2021 $CMG puts at $210 a week ago because of this.,CMG,210,Jan 2021,1
&gt; can we get something going plz   &gt;   &gt;Re  I have 3.50 puts for Friday  3 and 4 calls for January,plz,3.50,January,1
"I learned about IV crush when I bought $6 10/26 $SNAP puts on 10/25, and despite the stock absolutely cratering early in the day, I only got out at break-even on my initial cost. I was lucky for that because I missed the first low of $5.80, but thankfully it came around again a second time and I pulled out.",SNAP,6,10/26,1
I don’t half of the time either! I do know holding March 8th $276 SPY puts will probably prolapse my ass come Tuesday!,SPY,276,March 8th,1
A man of culture and intellect I see. I bet you would be interested in some $MU 90 1/7 calls,MU,90,1/7,1
Stocked up on some AMD 10/11 29.5c don’t let me down Su 🙏🙏,AMD,29.5,10/11,1
"My SPY 6/22 $280 calls I got for about $5 a contract might actually be worth a lot before too long.  Fucking nuts.  I should’ve bought more.  Actually they’re only worth $80ish now, maybe load up on more...",SPY,280,6/22,1
Msft $112 9/21 AAPL $230 9/28,Msft,112,9/21,1
$165 7/12 FDs down 20%. Give me shitty advice. I have cash to double down.,F,165,7/12,1
Like writing $10 Tesla put options for January 2020,Tesla,10,January 2020,1
"hold my $ATVI 2/15 39.5 puts or cash out at open. Decisions decisions. They're up over a100%, but I think ATVI shits the bed hard on guidance tomorrow...",ATVI,39.5,2/15,1
"I have 75 SPY 270 puts 11/2 , pretty anxious over here. Someone give me happy thoughts..",SPY,270,11/2,1
Thoughts on buying 87.5 PYPL C 10/19? Earnings  estimated 10/18,PYPL,87.5,10/19,1
"Do it, I have a limit for 3/15 $70 CSP at $1.45  If it hits will put my average cost around $68.50 if assigned. ",CSP,70,3/15,1
"I know you guys probably don't give 2 fucks about communist stonks but QIWI is an absolute monster. 8/16 22.5c are printing, jump on while you can",QIWI,22.,8/16,1
I didn't buy FD's because only a true autist would buy those with the current IV. I do have $220 11/23 calls though.,FD,220,11/23,1
I would tell you to buy calls on Dis @ 165 for October,Dis,165,October,1
"I’ve got some 11/30 ATVI 74.5s, hold through the butt plunging or?",ATVI,74.5,11/30,1
"Lost all of my V and MU day trade earnings on AMD 35 10/5 calls. Bought SQ calls the last hour of trading when they hit $89.68 brought me back up to $27 in the red. Could've been worse. Sitting on AMD calls, SNAP puts, GE puts, BAC calls,  SQ calls. Probably keep my hands in my fucking pockets not buy shit and pray the rosary.",AMD,35,10/5,1
Just YOLO d 5k in 10/19 BA 355 calls ,BA,355,10/19,1
Pray that $FB Feb 10 $134 calls go about about 2x tomorrow to recoup some of my losses.,FB,134,Feb 10,1
Oof. I got some nice and cheap ($1.67) AMD $19 calls expiring in October that are fucking killing it right now. Sorry to hear yours are expiring so early,AMD,19,October,1
Yeahhhhh I'm not selling my $22.50 Nov. 11/15 $BJ calls anytime soon it seems.,BJ,22.50,Nov. 11/15,1
"TKR calls, hoping for at least a 3 bagger after earnings on 47.50 may calls",TKR,47.50,may,1
"This is from 3 months so far. Made 100 on a NKE play before earnings as my first big one, few dumb calls on Starbucks that became worthless, bought an SEP $40 call for December and they recently announced enbridge their parent company is buying out all shares at $40 so another 100 or so. The rest is MSFT calls before Xbox announcement because of dividend increase rumors for Sept 18. I try to do a lot of DD before entering option trades.",NKE,40,SEP,1
Is there hope for my 222.5 9/14 Apple call? ,Apple,222.5,9/14,1
"I've been in GDX for the past few weeks. I fucking had weak hands and sold before the $1+ rise overnight last night. But I bought back in on a riskier play to make up for those gains. I have 20 7/19 $27 calls that I will reevaluate tomorrow morning. I think we may go up more before a bigger selloff, but part of me believes we're just going to keep going up until the next fed meet. (Which if they decide to not cut rates then, gold will go down)",GDX,27,7/19,1
9/21 Calls  $MSFT $115  $AAPL $230  $SQ $90 safe $95 risky  $TNDM $46  $ADBE $275  Suggestions. I think the msft was my fav from ta,MSFT,115,9/21,1
MU 8/31 $90 calls,MU,90,8/31,1
Anyone else playing CVS earnings? I have $69 11/15 calls I bought yesterday.,CVS,69,11/15,1
APPL $400 call 11/8,APPL,400,11/8,1
Ez tendies Spy $302 calls for end of month,Spy,302,end,1
"Buy 7/19 $290 TSLA calls with me  edit: 5/17 $20 ATSG puts as well. ATSG may continue to be priced stupidly though, sometimes the market just doesn't care",TSLA,290,7/19,1
Yep got 5 Mar 17 $115 puts ,Yep,115,Mar 17,1
I loaded up on more 11/9 VIX $35 Calls,VIX,35,11/9,1
"I played the opposite, I had 7/20 NFLX $420 calls.  Picked them up on the down spike on Tuesday, sold them off EoD yesterday for about $600 profit.  Took the money I had in NFLX calls are dumped them into 8/17 NVDA $250 calls.",NFLX,420,7/20,1
Holding some 1/18 ATVI $90 calls . Fingers crossed,ATVI,90,1/18,1
I got BAC Jan 31 $37 for .21 already up a little,BAC,37,Jan 31,1
Loaded up on some AMD $25 11/26 calls yeeee,AMD,25,11/26,1
"Going to pick up some $NOC 5/24 $310 calls. They went up quite a bit today, but IV is still pretty low. Think the situation in the Middle East is only going to get more fraught, so I think it's a solid play. Anyone thinking something similar?",NOC,310,5/24,1
Can I correctly time the unloading if these 3/22 $29.50 BAC puts today so I don't hate myself later?,BAC,29.50,3/22,1
"What the fuck? The fucking baby boomers ruin the millennials by forcing us into debt via college tuition and high rent, then take away the only investment instrument that guarantees our financial success? FUCK THIS SHIT. WHAT THE FUCK AM I SUPPOSED TO DO WITH MY $300 MAR17 UWTI calls I bought? Trump and Sanders were right, this shit is all rigged.",UWTI,300,MAR17,1
"So, I will be the douche bag and ask some stupid questions. I'm going to limit my stupid questions to buying calls. So, what factors make an option jump out to you? The 5/18 $47 KO calls did very little movement to be in the money. On the other hand, KO hasnt had much price movement over the past few months. So, even though this doesnt take much movement to be ITM, past performance would indicate that it is unlikely.   I bought some 2/16 FCX $14 calls back in November. They are up a lot since the original purchase. The only reason they came on my radar is a co-worker of mind mentioned he saw the Najarian brothers talking about the movement in this option. My co-worker typically doesn't always make the best picks so when he decided to pass on this, I gave it a go and it worked out. I know it is all gambling and risky, but what are some of the indicators you guys would use when looks at buying calls on a sheet like this?",FCX,47,5/18,1
"Got into $CBDS pretty early, but nowhere near the returns you're seeing with your play.  That's crazy man. I listened to someone here and opened a position on $MU -19 $42.5 and +19 41 puts expiring Jan 19. Needless to say, I did not hit the jackpot there. Conviction buy? What made you follow that guy...",MU,42.5,Jan 19,1
"Friday the 15th, I should be good, no worries  $63 TGT puts $340 TSLA puts",TGT,63,Friday,1
Debating on selling my LC Jan 20 2017 $7 call options that are up 38% and my LC Jan 19 2018 $8 options that are up 10%.  What do you think?  Sell (and buy again on a sell off) or let it ride?  ,LC,7,Jan 20 2017,1
"Gl man, alot of us are right there with you just with less ballsy expiry. Collected some more 10/19 52.5's today myself.",Gl,52.5,10/19,1
Any guesses on what’s gonna happen to my LULU  8/30 185 and 187.5 calls? Kinda YOLO’d 5 minutes before the orange one tweet stormed.,LULU,185,8/30,1
What a time to be alive. My $14.5 CRON 9/28 puts are gonna be on fire when TLRY takes a dump tomorrow morn. ,CRON,14.5,9/28,1
"I’ve been charting gopro since the beginning of last week. Monday of last week I had this fall pinpointed to a 2 day window. I have 10/12 $6.50 puts and believe it will fall to $6.20 before it finally has any major turnaround.   I can send you the charts &amp; visuals or I can explain it here if you want, but the 6.67 it closed at is not the bottom by any means in my eyes",go,6.50,10/12,1
"Holding 302 SPY calls 10/28, BAC  $29 call 10/18  Gonna pick up $5 APHA calls tomorrow",SPY,29,10/28,1
6/21 AMD 31.5p purchased,AMD,31.5,6/21,1
debating selling AMD put 26.5 MAY 24 currently down 16% but not sure if it'll continue to drop inbetween this time. If theres a pro trade announcement it'll bounce back.  Up 45% on Macy but debating holding until earning release on the 17th,AMD,26.5,MAY 24,1
"I bought 5 $280 jan 19th calls on Friday for $218, just sold them for $411. First options on SPY, is it really this easy and is WSB going to ruin it? ",SPY,280,jan 19th,1
Ouch. My $5.5 8/24 put on CHK hopes we have nice boring peace with too much production. ,CHK,5.5,8/24,1
"Lol Oct 25th $300 C's were 0.40 a pop. 2583 in open interest. If price holds overnight, they could open around 12.50 a pop",Lol,300,Oct 25th,1
Ive got 11 aapl 185 calls for 1/18. Keep or sell before close?,aapl,185,1/18,1
$SNAP 9 call 11/30 now at $.08 from .17.......AND that’s how you turn $1700 into $800 folks   EDIT: now at .07 and expecting to continue to drop- I won’t sell,SNAP,9,11/30,1
4/4 with a modest $110 profit (90-200) on four separate MSFT calls in the last two weeks. Poppas makin drug money boyz,MSFT,110,4/4,1
"Alternatively, Dec 2700 ES Puts",ES,2700,Dec,1
"BAC at $35.13 up .43 today. Bought 18 $36 calls 12/20, looking like there might be potential for a payout. Still only valued at $.02 tho 😡",BAC,35.13,12/20,1
A trade confirmation is available online for this transaction in your Capital One Investing account:  Action: Buy Description: AMD SEP 29 2017 13.00 CALL Quantity*: 100 contracts Execution time: 09-20-2017 14:48 ET Price: $0.32 Total Commissions &amp; Charges: $81.95 Total Transaction Amount: $3281.95 Trade Settlement Date: 09-21-2017 ,AMD,13.00,SEP 29 2017,1
I bought 1/17 OXY $40 calls.  How dumb am I? Who even gets OXY calls?,OXY,40,1/17,1
Actually buying those $100 puts for roku exp next week,roku,100,next week,1
"Don't worry guys, just bought SPY Feb 16 275 puts.  Shit's going back to the moon!",SPY,275,Feb 16,1
Does anyone remember Facebook puts guy... claimed to be a professor who was telling people to get FB $130 puts for a few months out and he was mercilessly mocked? Then in December it actually went below $130,FB,130,December,1
"Shorted $30k worth at avg price of $21.29, up over $1,400.  Also sold March 17 $20 puts last night for $.30, closed them for $.10 during the dead cat bounce this morning for an easy $180 profit.",avg,20,March 17,1
"Now sell calls against your 400 shares.  The $180 strike for next week is selling for $0.80 mid right now.  If AAPL doesn't close above $180 next Friday, that's $320 in your pocket.  If it closes above $180, that's another $4000 in your pocket.  If shares get called away, write puts until you get it back.  If you happen to be holding during an ex-dividend date, that's another ~$300 in your pocket.  Rinse, repeat. ",AAPL,180,next,1
so nobody else bought them only your friend  be honest   you don't have a friend and you bought 1x  1/11 SPY $240 ,SPY,240,1/11,1
I already have some CHK $5 strike july 15s and USO 11.50 july 15s. But such small calls only $400 each. Was looking to making a huge a 11.50 USO july 22nd call make some real money. ,CHK,5,july,1
How far will TSLA moon? Asking for a friend holding short $255 10/18 calls.,TSLA,255,10/18,1
Since my $11 April 27 calls on AMD are already down 30% Ill just hold thru earnings. Seems different this time (said the idiot).,AMD,11,April 27,1
"well my SPY 287.5/287 9/16 puts are dead, so happy i doubled down.  Should I ditch them or steady hands?  I do have 2 288c ecxp 9/6 that im holding but damn.",SPY,287.,9/16,1
"Ok, just got in SBUX calls $84 11/15 0.85 average, guys its time for u to go all in puts.",SBUX,84,11/15,1
 $RF bank $13 puts now for April 18 now,RF bank,13,April 18,1
GLD Mid August 140 calls,GLD,140,Mid,1
Right but can you give me an example like 9.50 DUST June 17 calls or something ? I'm just looking to base something to learn more from an example in this situation ,DUST,9.50,June 17,1
"Heh, my $26 11/15 Puts just sold for a 20% profit so I am okay with this news. Maybe buy back in tomorrow afternoon at $28",Heh,26,11/15,1
I got a few on calls for nov. 15th $35. Hbu?,Hbu,35,nov. 15th,1
"you should write a script that reverses every trade you make. So you put in ""buy 200 AMD $30 december calls"" and it either sells 200 AMD calls or buys 200 AMD puts. But take a few xanax bars before you do it so you forget you made the script. That way you won't psych yourself out by knowing you're actually inversing every trade  Maybe you could ask your brokerage (if you had a real one) to reverse every trade you make. I wonder what schwab would tell me if I asked them to do that. ",AMD,30,december,1
Continue to [NOT] look at my MAY19 MSFT 95 calls. ,MSFT,95,MAY19,1
im planning on buying some AAPL 8/16 $195 puts at open tomorrow. wouldn't suggest selling in the same day though,AAPL,195,8/16,1
Goddammit. I bought ATVI $71.5 11/30 Calls yesterday and now I see someone on WSB saying this might have been a good call?! You better not jinx this for me!,ATVI,71.5,11/30,1
11 USO 8/9 11C $99,USO,99,8/9,1
My htz $5 5/30 puts are safe right? No way this shit pumps...right?,htz,5,5/30,1
You'll look back and realize you forgot to buy     Leg   $45 puts   February (month after January),Leg,45,February,1
"They closed a $6,000,000 long position, so good bet IMO. I see some put buying coming into the $52 August put as well ",IM,52,August,1
"Averaged down on my ACB $9 4/18 calls. All out of buying power for now, playing it slow. GLA",ACB,9,4/18,1
Thinking about 3/15 77.5c on TGT. Looking at that open interest. Someone knows something or there are a lot of wsb retards playing this.,TGT,77.5,3/15,1
Bought AMD 10/12 $25 calls at open. Sold just now for all the tendies...,AMD,25,10/12,1
I have x50 QQQ $210 Aug 16/19 calls cost averaged 0.11....  Do you think I'm fucked?,QQQ,210,Aug 16/19,1
Doubled my calendar spread on EFA. Up 8k as of Monday.  Sitting short on 60 $59 June 24 Calls and long 60 $58.50 July 1 calls. Looking for a relief rally to $59 on Friday. Profits for anything below $59.45 by Friday and above 58.90 before July 1.  Avg short at $0.45 and long at $0.85.   Oh... and everyone must have forgot this went ex-div today with all the Brexit hoopla.,EFA,59,June 24,1
"I've got some XLF Jun 15  $30 calls, but I may buy some Jan 19 puts to hedge my bet",XLF,30,Jun 15,1
Amd 2/7 53.5 calls sinking ship? Sell?,Amd,53.5,2/7,1
"There were a few other unusual transactions involving different strike prices, and different companies as well. This one was the most damming because, before and after this purchase, volume for IBB (290.00 strike August 26th expiry) was almost nonexistent. These options would have expired worthless in 2 days in any normal scenario, so no one else was buying them.",IBB,290.00,August 26th,1
"Give me a really, really GOOD reason NOT to yeet $500 into   4/12 RAD 1c's",RAD,500,4/12,1
